{
    "devices": {
        "IO (EtherCAT)": {
            "enabled": true,
            "masterNetId": "0.0.0.0.2.1",
            "targetNetId": "169.254.221.1.1.1"
        },
        "XPlanar": {
            "enabled": true,
            "masterNetId": "0.0.0.0.4.1",
            "targetNetId": "169.254.221.1.1.1"
        }
    },
    "runtimeStateCheckTimeout": "PT5S",
    "updateIntervals": {
        "MasterList": 1000,
        "MasterOnlineInfo": 300,
        "ProcessDataValues": 1000,
        "Slaves": 1000,
        "SlavesOnlineInfo": 1000
    },
    "vendorsOverwrite": {
        "1": {
            "devices": [],
            "longName": "EtherCAT Technology Group",
            "shortName": "ETG"
        },
        "2": {
            "devices": [],
            "longName": "Beckhoff Automation GmbH & Co. KG",
            "shortName": "Beckhoff"
        }
    }
}